{
  "schema_version": "0.1.0",
  "handle": "secret://job/job_99/publish_token",
  "owner_principal_id": "user_chase",
  "purpose": "Publish one approved artifact",
  "audiences": [
    "social.example"
  ],
  "capabilities": [
    "publish.external"
  ],
  "target_refs": [
    {
      "type": "artifact",
      "id": "artifact_vertical_final"
    }
  ],
  "created_at": "2026-07-14T17:30:00Z",
  "expires_at": "2026-07-14T17:45:00Z",
  "max_resolutions": 1,
  "resolution_count": 0,
  "status": "active",
  "retention_evidence_ref": null
}
